,Order Date,Category,Sub-Category,Product Name,Sales,Quantity,Day,Month,Year283,2011-01-11,Office Supplies,Binders,"Avery Hole Reinforcements, Recycled",28.62,6,11,1,2011
284,2011-01-11,Office Supplies,Binders,"Avery Hole Reinforcements, Recycled",28.62,6,11,1,2011
285,2011-01-11,Office Supplies,Paper,Xerox 1934,167.94,3,11,1,2011
286,2011-01-11,Office Supplies,Labels,"Avery Shipping Labels, Laser Printer Compatible",33.18,7,11,1,2011
287,2011-01-11,Office Supplies,Labels,Avery 475,44.4,3,11,1,2011
288,2011-01-11,Office Supplies,Labels,"Harbour Creations File Folder Labels, Adjustable",8.84,2,11,1,2011
289,2011-01-11,Office Supplies,Art,Model L Table or Wall-Mount Pencil Sharpener,43.176,3,11,1,2011
290,2011-01-11,Office Supplies,Art,"Binney & Smith Highlighters, Blue",33.18,2,11,1,2011
291,2011-01-11,Office Supplies,Binders,"Avery 3-Hole Punch, Recycled",28.23,1,11,1,2011
292,2011-01-11,Furniture,Furnishings,"Master Big Foot Doorstop, Beige",31.68,6,11,1,2011
293,2011-01-11,Office Supplies,Paper,Southworth Parchment Paper & Envelopes,15.696,3,11,1,2011
294,2011-01-11,Office Supplies,Art,"Sanford Highlighters, Blue",15.75,1,11,1,2011
295,2011-01-11,Office Supplies,Binders,GBC Standard Therm-A-Bind Covers,22.428,3,11,1,2011
296,2011-01-11,Office Supplies,Fasteners,"Stockwell Push Pins, Assorted Sizes",23.64,3,11,1,2011
297,2011-01-11,Office Supplies,Binders,"Cardinal 3-Hole Punch, Recycled",11.664,1,11,1,2011
298,2011-01-11,Office Supplies,Storage,"Eldon Folders, Industrial",6.984,1,11,1,2011
299,2011-01-11,Office Supplies,Art,Newell 320,10.272,3,11,1,2011
300,2011-01-11,Office Supplies,Paper,Staples,21.4,5,11,1,2011
301,2011-01-11,Office Supplies,Art,"OIC #2 Pencils, Medium Soft",5.64,3,11,1,2011
302,2011-01-11,Office Supplies,Storage,"Smead Box, Wire Frame",3.936,1,11,1,2011
303,2011-01-11,Office Supplies,Fasteners,Staples,7.52,5,11,1,2011
304,2011-01-11,Office Supplies,Binders,Acco Economy Flexible Poly Round Ring Binder,3.132,2,11,1,2011
305,2011-01-12,Furniture,Chairs,Office Star - Professional Matrix Back Chair with 2-to-1 Synchro Tilt and Mesh Fabric Seat,2807.84,8,12,1,2011
306,2011-01-12,Technology,Accessories,"Belkin Router, Erganomic",1795.92,7,12,1,2011
307,2011-01-12,Furniture,Chairs,Hon Multipurpose Stacking Arm Chairs,909.72,6,12,1,2011
308,2011-01-12,Furniture,Chairs,Hon 4070 Series Pagoda Round Back Stacking Chairs,674.058,3,12,1,2011
309,2011-01-12,Furniture,Tables,"Bevis Computer Table, Adjustable Height",1181.016,4,12,1,2011
310,2011-01-12,Technology,Copiers,"Brother Wireless Fax, Laser",1894.05,5,12,1,2011
311,2011-01-12,Office Supplies,Binders,"Acco Binding Machine, Recycled",180.075,7,12,1,2011
312,2011-01-12,Technology,Phones,Cisco IP Phone 7961G VoIP phone - Dark gray,271.9,2,12,1,2011
313,2011-01-12,Technology,Copiers,Sharp 1540cs Digital Laser Copier,659.988,2,12,1,2011
314,2011-01-12,Furniture,Furnishings,"Rubbermaid Frame, Black",219.78,2,12,1,2011
315,2011-01-12,Furniture,Bookcases,"Sauder Corner Shelving, Traditional",491.0,5,12,1,2011
316,2011-01-12,Office Supplies,Storage,"Eldon Shelving, Single Width",392.445,9,12,1,2011
317,2011-01-12,Office Supplies,Storage,"Rogers Shelving, Single Width",111.888,2,12,1,2011
318,2011-01-12,Technology,Copiers,"Hewlett Personal Copier, Digital",181.3266,2,12,1,2011
319,2011-01-12,Office Supplies,Envelopes,"Kraft Peel and Seal, Recycled",173.61,9,12,1,2011
320,2011-01-12,Furniture,Chairs,"SAFCO Bag Chairs, Set of Two",103.38,2,12,1,2011
321,2011-01-12,Furniture,Bookcases,"Ikea Stackable Bookrack, Mobile",583.8,7,12,1,2011
322,2011-01-12,Furniture,Furnishings,"Deflect-O Frame, Black",220.08,3,12,1,2011
323,2011-01-12,Office Supplies,Labels,"Hon Shipping Labels, Laser Printer Compatible",102.33,9,12,1,2011
324,2011-01-12,Office Supplies,Art,"Hunt BOSTON Vista Battery-Operated Pencil Sharpener, Black",46.64,4,12,1,2011
325,2011-01-12,Office Supplies,Storage,"Fellowes Shelving, Industrial",58.32,1,12,1,2011
326,2011-01-12,Furniture,Chairs,"Novimex Chairmat, Adjustable",117.66,3,12,1,2011
327,2011-01-12,Office Supplies,Art,"BIC Highlighters, Blue",75.72,4,12,1,2011
328,2011-01-12,Office Supplies,Binders,"Acco Binding Machine, Economy",102.18,3,12,1,2011
329,2011-01-12,Technology,Accessories,"SanDisk Mouse, Bluetooth",76.62,3,12,1,2011
330,2011-01-12,Office Supplies,Paper,"Eaton Note Cards, 8.5 x 11",26.49,1,12,1,2011
331,2011-01-12,Furniture,Furnishings,"Linden 10"" Round Wall Clock, Black",45.84,3,12,1,2011
332,2011-01-12,Furniture,Furnishings,"Floodlight Indoor Halogen Bulbs, 1 Bulb per Pack, 60 Watts",58.2,3,12,1,2011
333,2011-01-12,Technology,Phones,"BlueLounge Milo Smartphone Stand, White/Metallic",95.968,4,12,1,2011
334,2011-01-12,Technology,Phones,"Motorola Headset, Full Size",64.824,2,12,1,2011
335,2011-01-12,Furniture,Furnishings,"Rubbermaid Light Bulb, Black",55.0128,4,12,1,2011
336,2011-01-12,Office Supplies,Labels,"Avery Shipping Labels, 5000 Label Set",57.12,7,12,1,2011
337,2011-01-12,Office Supplies,Fasteners,"Advantus Rubber Bands, Assorted Sizes",25.272,6,12,1,2011
338,2011-01-12,Office Supplies,Art,"BIC Markers, Water Color",29.61,1,12,1,2011
339,2011-01-12,Office Supplies,Art,"Sanford Pencil Sharpener, Water Color",38.68,2,12,1,2011
340,2011-01-12,Office Supplies,Paper,"Eaton Message Books, Recycled",27.32,2,12,1,2011
341,2011-01-12,Office Supplies,Paper,Xerox 214,36.288,7,12,1,2011
342,2011-01-12,Furniture,Chairs,"Hon Bag Chairs, Black",28.48,1,12,1,2011
343,2011-01-12,Office Supplies,Binders,"Cardinal Binder, Clear",44.1228,4,12,1,2011
344,2011-01-12,Office Supplies,Fasteners,"OIC Paper Clips, 12 Pack",13.86,1,12,1,2011
345,2011-01-12,Furniture,Furnishings,Ultra Door Push Plate,9.82,2,12,1,2011
346,2011-01-12,Office Supplies,Labels,"Avery Shipping Labels, Alphabetical",11.67,1,12,1,2011
347,2011-01-12,Furniture,Furnishings,"Master Caster Door Stop, Brown",8.128,2,12,1,2011
348,2011-01-12,Office Supplies,Binders,"Ibico Binder Covers, Clear",3.933,1,12,1,2011
349,2011-01-12,Office Supplies,Labels,"Smead Shipping Labels, Adjustable",6.34,1,12,1,2011
350,2011-02-01,Technology,Machines,"Okidata Inkjet, Wireless",314.22,1,1,2,2011
351,2011-02-02,Furniture,Bookcases,"Safco Stackable Bookrack, Pine",1052.31,7,2,2,2011
352,2011-02-02,Technology,Phones,"Motorola Signal Booster, Cordless",583.92,8,2,2,2011
353,2011-02-02,Technology,Copiers,"Hewlett Copy Machine, Color",549.927,6,2,2,2011
354,2011-02-02,Office Supplies,Storage,"Eldon File Cart, Blue",380.88,3,2,2,2011
355,2011-02-02,Technology,Phones,"Cisco Smart Phone, Full Size",587.412,1,2,2,2011
356,2011-02-02,Technology,Copiers,"Brother Wireless Fax, Laser",378.81,1,2,2,2011
357,2011-02-02,Furniture,Tables,"Bevis Computer Table, Fully Assembled",692.328,2,2,2,2011
358,2011-02-02,Technology,Accessories,Enermax Aurora Lite Keyboard,468.9,6,2,2,2011
359,2011-02-02,Furniture,Bookcases,"Ikea Library with Doors, Pine",729.48,2,2,2,2011
360,2011-02-02,Technology,Phones,"Cisco Headset, Full Size",161.514,2,2,2,2011
361,2011-02-02,Furniture,Chairs,"Novimex Executive Leather Armchair, Black",334.3035,1,2,2,2011
362,2011-02-02,Office Supplies,Storage,"Fellowes File Cart, Industrial",248.022,2,2,2,2011
363,2011-02-02,Technology,Machines,"Epson Receipt Printer, Wireless",468.12,4,2,2,2011
364,2011-02-02,Furniture,Chairs,"SAFCO Steel Folding Chair, Black",266.496,4,2,2,2011
365,2011-02-02,Technology,Copiers,"HP Fax and Copier, Digital",86.265,1,2,2,2011
366,2011-02-02,Office Supplies,Art,"Stanley Canvas, Blue",104.8764,4,2,2,2011
367,2011-02-02,Technology,Machines,"Konica Phone, White",88.83,3,2,2,2011
368,2011-02-02,Office Supplies,Paper,"SanDisk Memo Slips, Multicolor",45.975,5,2,2,2011
369,2011-02-02,Technology,Accessories,"Logitech Numeric Keypad, Erganomic",44.13,2,2,2,2011
370,2011-02-02,Office Supplies,Art,"Boston Highlighters, Water Color",44.1,2,2,2,2011
371,2011-02-02,Office Supplies,Art,"BIC Canvas, Water Color",56.88,1,2,2,2011
372,2011-02-02,Office Supplies,Art,"Sanford Pencil Sharpener, Water Color",116.04,4,2,2,2011
373,2011-02-02,Office Supplies,Supplies,"Acme Box Cutter, High Speed",37.8,1,2,2,2011
374,2011-02-02,Office Supplies,Art,"Sanford Highlighters, Water Color",94.65,5,2,2,2011
375,2011-02-02,Office Supplies,Paper,"Xerox Note Cards, Premium",13.185,1,2,2,2011
376,2011-02-02,Office Supplies,Labels,"Avery Color Coded Labels, 5000 Label Set",43.5024,6,2,2,2011
377,2011-02-02,Furniture,Furnishings,"Rubbermaid Light Bulb, Duo Pack",34.02,2,2,2,2011
378,2011-02-03,Furniture,Bookcases,"Ikea Corner Shelving, Traditional",775.278,7,3,2,2011
379,2011-02-03,Furniture,Bookcases,"Ikea 3-Shelf Cabinet, Pine",776.466,6,3,2,2011
380,2011-02-03,Furniture,Chairs,"Office Star Executive Leather Armchair, Black",682.4478,2,3,2,2011
381,2011-02-03,Furniture,Chairs,"Harbour Creations Steel Folding Chair, Black",257.742,3,3,2,2011
382,2011-02-03,Technology,Copiers,"Canon Wireless Fax, Digital",1055.457,3,3,2,2011
383,2011-02-03,Office Supplies,Storage,"Rogers Lockers, Wire Frame",210.69,1,3,2,2011
384,2011-02-03,Technology,Accessories,Hypercom P1300 Pinpad,151.2,3,3,2,2011
385,2011-02-03,Office Supplies,Binders,"Acco Binder Covers, Durable",106.704,8,3,2,2011
386,2011-02-03,Office Supplies,Paper,"Enermax Message Books, 8.5 x 11",35.52,2,3,2,2011
387,2011-02-03,Office Supplies,Paper,"Array Parchment Paper, Assorted Colors",36.4,5,3,2,2011
388,2011-02-03,Office Supplies,Art,"Stanley Markers, Water Color",45.684,2,3,2,2011
389,2011-02-03,Office Supplies,Envelopes,Staples,11.36,2,3,2,2011
390,2011-02-03,Office Supplies,Paper,Xerox 1971,3.424,1,3,2,2011
391,2011-02-04,Office Supplies,Appliances,"KitchenAid Stove, Black",683.496,3,4,2,2011
392,2011-02-04,Technology,Phones,Motorola Droid Maxx,1049.93,7,4,2,2011
393,2011-02-04,Technology,Phones,"Samsung Smart Phone, Cordless",1278.0,2,4,2,2011
394,2011-02-04,Technology,Copiers,"HP Ink, High-Speed",228.42,2,4,2,2011
395,2011-02-04,Office Supplies,Appliances,"KitchenAid Stove, Black",455.664,3,4,2,2011
396,2011-02-04,Technology,Machines,"Okidata Card Printer, White",522.72,3,4,2,2011
397,2011-02-04,Technology,Phones,"Samsung Smart Phone, Cordless",3195.0,5,4,2,2011
398,2011-02-04,Technology,Copiers,"Hewlett Fax and Copier, Laser",153.52452,3,4,2,2011
399,2011-02-04,Office Supplies,Appliances,Euro-Pro Shark Turbo Vacuum,154.9,5,4,2,2011
400,2011-02-04,Furniture,Furnishings,Luxo Adjustable Task Clamp Lamp,177.68,2,4,2,2011
401,2011-02-04,Technology,Copiers,"Hewlett Fax and Copier, Laser",230.67252,3,4,2,2011
402,2011-02-04,Technology,Copiers,"Canon Personal Copier, Color",114.76728,3,4,2,2011
403,2011-02-04,Technology,Phones,"Motorola Headset, Full Size",81.03,1,4,2,2011
404,2011-02-04,Office Supplies,Paper,"SanDisk Parchment Paper, Recycled",149.58,9,4,2,2011
405,2011-02-04,Office Supplies,Art,"Stanley Pencil Sharpener, Water Color",111.84,4,4,2,2011
406,2011-02-04,Technology,Copiers,"Canon Personal Copier, Color",172.43928,3,4,2,2011
407,2011-02-04,Office Supplies,Envelopes,"Ames Mailers, Recycled",18.48,2,4,2,2011
408,2011-02-04,Office Supplies,Art,"BIC Highlighters, Blue",18.93,1,4,2,2011
409,2011-02-04,Office Supplies,Labels,"Harbour Creations Round Labels, 5000 Label Set",11.8524,2,4,2,2011
410,2011-02-04,Office Supplies,Envelopes,"Ames Mailers, Recycled",27.72,2,4,2,2011
411,2011-02-04,Office Supplies,Paper,Xerox 1947,33.488,7,4,2,2011
412,2011-02-04,Office Supplies,Paper,Xerox 1990,15.84,3,4,2,2011
413,2011-02-04,Office Supplies,Labels,"Harbour Creations Shipping Labels, Adjustable",9.36,1,4,2,2011
414,2011-02-04,Office Supplies,Paper,Xerox 1898,26.72,5,4,2,2011
415,2011-02-05,Furniture,Chairs,"SAFCO Executive Leather Armchair, Black",2754.0,6,5,2,2011
416,2011-02-05,Office Supplies,Appliances,"KitchenAid Refrigerator, Silver",1057.38,2,5,2,2011
417,2011-02-05,Technology,Copiers,Brother DCP1000 Digital 3 in 1 Multifunction Machine,479.984,2,5,2,2011
418,2011-02-05,Office Supplies,Appliances,"Hoover Microwave, Red",1388.88,5,5,2,2011
419,2011-02-05,Furniture,Chairs,"Harbour Creations Bag Chairs, Red",246.48,4,5,2,2011
420,2011-02-05,Technology,Phones,"Cisco Signal Booster, Cordless",309.36,2,5,2,2011
421,2011-02-05,Technology,Copiers,"HP Ink, Color",520.56,4,5,2,2011
422,2011-02-05,Technology,Accessories,"SanDisk Memory Card, Bluetooth",337.23,3,5,2,2011
423,2011-02-05,Technology,Phones,"Apple Office Telephone, Full Size",266.28,4,5,2,2011
424,2011-02-05,Furniture,Furnishings,"Tenex Photo Frame, Duo Pack",155.7,3,5,2,2011
425,2011-02-05,Office Supplies,Storage,"Fellowes Shelving, Wire Frame",236.1765,5,5,2,2011
426,2011-02-05,Furniture,Bookcases,"Ikea 3-Shelf Cabinet, Pine",287.58,2,5,2,2011
427,2011-02-05,Office Supplies,Supplies,"Acme Letter Opener, Serrated",80.73,3,5,2,2011
428,2011-02-05,Furniture,Chairs,"Hon Rocking Chair, Red",476.763,5,5,2,2011
429,2011-02-05,Office Supplies,Supplies,"Stiletto Scissors, Steel",115.05,5,5,2,2011
430,2011-02-05,Technology,Accessories,"Memorex Router, Erganomic",73.206,1,5,2,2011
431,2011-02-05,Technology,Machines,"Epson Phone, Wireless",161.94,2,5,2,2011
432,2011-02-05,Office Supplies,Art,"Boston Sketch Pad, Easy-Erase",97.74,2,5,2,2011
433,2011-02-05,Office Supplies,Appliances,Belkin 6 Outlet Metallic Surge Strip,26.136,3,5,2,2011
434,2011-02-05,Office Supplies,Art,"BIC Pencil Sharpener, Easy-Erase",58.56,2,5,2,2011
435,2011-02-05,Office Supplies,Binders,"Cardinal Binding Machine, Clear",49.23,1,5,2,2011
436,2011-02-05,Office Supplies,Labels,"Harbour Creations Shipping Labels, 5000 Label Set",49.1775,5,5,2,2011
437,2011-02-05,Office Supplies,Fasteners,"Stockwell Thumb Tacks, Assorted Sizes",24.156,4,5,2,2011
438,2011-02-05,Office Supplies,Fasteners,"Stockwell Push Pins, 12 Pack",22.908,2,5,2,2011
439,2011-02-06,Furniture,Chairs,"SAFCO Executive Leather Armchair, Adjustable",1252.584,3,6,2,2011
440,2011-02-06,Office Supplies,Appliances,"KitchenAid Stove, Red",2052.54,4,6,2,2011
441,2011-02-06,Furniture,Bookcases,"Sauder Stackable Bookrack, Pine",413.3943,3,6,2,2011
442,2011-02-06,Furniture,Tables,"Lesro Wood Table, Adjustable Height",1502.784,6,6,2,2011
443,2011-02-06,Technology,Accessories,"Memorex Router, Erganomic",976.08,4,6,2,2011
444,2011-02-06,Office Supplies,Storage,"Hot File 7-Pocket, Floor Stand",356.94,2,6,2,2011
445,2011-02-06,Technology,Copiers,"Brother Ink, Laser",441.9,3,6,2,2011
446,2011-02-06,Technology,Accessories,"SanDisk Memory Card, Bluetooth",449.64,6,6,2,2011
447,2011-02-06,Furniture,Chairs,"Hon Swivel Stool, Black",1160.784,8,6,2,2011
448,2011-02-06,Office Supplies,Storage,"Tenex File Cart, Blue",266.4,2,6,2,2011
449,2011-02-06,Office Supplies,Supplies,"Fiskars Trimmer, Easy Grip",219.6,5,6,2,2011
450,2011-02-06,Furniture,Chairs,"Office Star Rocking Chair, Set of Two",286.32,3,6,2,2011
451,2011-02-06,Technology,Phones,Mophie Juice Pack Helium for iPhone,239.97,3,6,2,2011
452,2011-02-06,Technology,Accessories,"Belkin Router, Bluetooth",388.125,3,6,2,2011
453,2011-02-06,Technology,Machines,"Epson Phone, Durable",243.27,6,6,2,2011
454,2011-02-06,Technology,Accessories,"Belkin Mouse, Erganomic",138.672,4,6,2,2011
455,2011-02-06,Technology,Accessories,"Enermax Numeric Keypad, Bluetooth",345.24,9,6,2,2011
456,2011-02-06,Technology,Phones,"Motorola Headset, Full Size",275.502,4,6,2,2011
457,2011-02-06,Furniture,Tables,"Barricks Training Table, Rectangular",126.348,1,6,2,2011
458,2011-02-06,Office Supplies,Supplies,"Fiskars Shears, Easy Grip",182.7546,7,6,2,2011
459,2011-02-06,Office Supplies,Appliances,"Hoover Toaster, Red",125.46,3,6,2,2011
460,2011-02-06,Office Supplies,Paper,"Eaton Cards & Envelopes, Recycled",90.18,4,6,2,2011
461,2011-02-06,Office Supplies,Storage,"Eldon Trays, Wire Frame",56.448,2,6,2,2011
462,2011-02-06,Office Supplies,Binders,"Ibico Binder Covers, Recycled",112.08,8,6,2,2011
463,2011-02-06,Furniture,Furnishings,"Tenex Stacking Tray, Durable",100.92,5,6,2,2011
464,2011-02-06,Office Supplies,Binders,"Cardinal Binding Machine, Economy",49.77,2,6,2,2011
465,2011-02-06,Office Supplies,Supplies,"Fiskars Letter Opener, High Speed",72.88,4,6,2,2011
466,2011-02-06,Technology,Accessories,"Belkin Mouse, Bluetooth",81.42,2,6,2,2011
467,2011-02-06,Office Supplies,Binders,GBC Standard Therm-A-Bind Covers,59.808,3,6,2,2011
468,2011-02-06,Office Supplies,Paper,"SanDisk Memo Slips, 8.5 x 11",57.024,3,6,2,2011
469,2011-02-06,Furniture,Furnishings,Aluminum Document Frame,73.32,6,6,2,2011
470,2011-02-06,Office Supplies,Storage,"Tenex Box, Industrial",50.94,3,6,2,2011
471,2011-02-06,Furniture,Chairs,"Hon Swivel Stool, Black",48.366,1,6,2,2011
472,2011-02-06,Furniture,Furnishings,"Eldon Clock, Duo Pack",22.632,1,6,2,2011
473,2011-02-06,Office Supplies,Supplies,"Stiletto Letter Opener, Steel",26.5848,2,6,2,2011
474,2011-02-06,Office Supplies,Storage,"Tenex Shelving, Blue",21.864,1,6,2,2011
475,2011-02-06,Office Supplies,Storage,"Eldon Folders, Blue",28.1868,2,6,2,2011
476,2011-02-06,Office Supplies,Labels,"Harbour Creations Removable Labels, Laser Printer Compatible",30.51,3,6,2,2011
477,2011-02-06,Furniture,Furnishings,"Advantus Door Stop, Erganomic",29.1,1,6,2,2011
478,2011-02-06,Office Supplies,Labels,"Harbour Creations Round Labels, Alphabetical",21.9,5,6,2,2011
479,2011-02-06,Office Supplies,Art,"Sanford Colorific Scented Colored Pencils, 12/Pack",8.56,2,6,2,2011
480,2011-02-06,Office Supplies,Binders,"Ibico Binder, Economy",12.384,2,6,2,2011
481,2011-02-06,Office Supplies,Binders,"Wilson Jones Hole Reinforcements, Economy",7.5198,2,6,2,2011
482,2011-02-06,Office Supplies,Art,"Sanford Pens, Fluorescent",9.888,2,6,2,2011
483,2011-02-07,Technology,Copiers,"Canon Personal Copier, Laser",171.288,2,7,2,2011
484,2011-02-07,Technology,Phones,"Logitech B530 USB Headset - headset - Full size, Binaural",73.98,2,7,2,2011
485,2011-02-07,Office Supplies,Art,"Sanford Markers, Blue",34.875,3,7,2,2011
486,2011-02-07,Office Supplies,Binders,"Cardinal 3-Hole Punch, Economy",46.08,3,7,2,2011
487,2011-02-07,Office Supplies,Supplies,"Stiletto Scissors, High Speed",25.184,2,7,2,2011
488,2011-02-07,Office Supplies,Binders,"Acco Hole Reinforcements, Economy",31.968,8,7,2,2011
489,2011-02-07,Office Supplies,Art,DIXON Ticonderoga Erasable Checking Pencils,5.58,1,7,2,2011
490,2011-02-08,Office Supplies,Storage,Smead Adjustable Mobile File Trolley with Lockable Top,838.38,2,8,2,2011
491,2011-02-08,Furniture,Chairs,"SAFCO Executive Leather Armchair, Black",275.4,2,8,2,2011
492,2011-02-08,Furniture,Chairs,"Novimex Executive Leather Armchair, Adjustable",911.04,2,8,2,2011
493,2011-02-08,Technology,Copiers,"Sharp Fax Machine, Color",178.254,2,8,2,2011
494,2011-02-08,Furniture,Chairs,"SAFCO Rocking Chair, Black",847.872,12,8,2,2011
495,2011-02-08,Furniture,Tables,"Barricks Computer Table, Adjustable Height",142.623,1,8,2,2011
496,2011-02-08,Office Supplies,Art,"Sanford Sketch Pad, Fluorescent",280.44,6,8,2,2011
497,2011-02-08,Furniture,Chairs,"Hon Bag Chairs, Red",90.3,2,8,2,2011
498,2011-02-08,Office Supplies,Paper,"Xerox Note Cards, Recycled",157.68,6,8,2,2011
499,2011-02-08,Office Supplies,Storage,"Eldon Shelving, Blue",87.156,6,8,2,2011
500,2011-02-08,Office Supplies,Art,"Stanley Markers, Water Color",101.52,4,8,2,2011
501,2011-02-08,Office Supplies,Paper,"Xerox Cards & Envelopes, Premium",179.88,6,8,2,2011
502,2011-02-08,Office Supplies,Binders,"Acco Binding Machine, Clear",101.1,2,8,2,2011
503,2011-02-08,Technology,Machines,"Konica Card Printer, Durable",262.935,2,8,2,2011
504,2011-02-08,Office Supplies,Supplies,"Elite Trimmer, Serrated",115.11,3,8,2,2011
505,2011-02-08,Office Supplies,Supplies,"Acme Trimmer, Steel",87.96,3,8,2,2011
506,2011-02-08,Technology,Accessories,"Memorex Keyboard, USB",143.1,2,8,2,2011
507,2011-02-08,Furniture,Bookcases,"Bush 3-Shelf Cabinet, Mobile",43.767,1,8,2,2011
508,2011-02-08,Office Supplies,Fasteners,"OIC Rubber Bands, Assorted Sizes",96.8,10,8,2,2011
509,2011-02-08,Office Supplies,Supplies,"Elite Ruler, Serrated",18.9,6,8,2,2011
510,2011-02-08,Office Supplies,Envelopes,"Cameo Clasp Envelope, Recycled",13.296,4,8,2,2011
511,2011-02-08,Technology,Accessories,"Belkin Mouse, Programmable",116.0775,5,8,2,2011
512,2011-02-08,Office Supplies,Art,"Binney & Smith Markers, Easy-Erase",29.232,4,8,2,2011
513,2011-02-08,Office Supplies,Envelopes,"GlobeWeis Interoffice Envelope, Recycled",62.16,2,8,2,2011
514,2011-02-08,Office Supplies,Art,"Sanford Highlighters, Fluorescent",34.02,2,8,2,2011
515,2011-02-08,Office Supplies,Binders,Wilson Jones 14 Line Acrylic Coated Pressboard Data Binders,26.7,5,8,2,2011
516,2011-02-08,Office Supplies,Labels,"Hon Shipping Labels, Laser Printer Compatible",22.74,2,8,2,2011
517,2011-02-08,Office Supplies,Labels,"Hon Legal Exhibit Labels, Laser Printer Compatible",28.96,4,8,2,2011
518,2011-02-08,Office Supplies,Paper,"Eaton Parchment Paper, 8.5 x 11",10.566,2,8,2,2011
519,2011-02-08,Technology,Accessories,Memorex Micro Travel Drive 4 GB,21.2,2,8,2,2011
520,2011-02-08,Office Supplies,Fasteners,"Accos Thumb Tacks, Metal",4.14,1,8,2,2011
521,2011-02-08,Office Supplies,Binders,"Ibico Index Tab, Economy",10.41,1,8,2,2011
522,2011-02-08,Furniture,Furnishings,"Tenex Light Bulb, Durable",4.788,1,8,2,2011
523,2011-02-09,Furniture,Tables,"Hon Conference Table, Fully Assembled",922.95,1,9,2,2011
524,2011-02-09,Furniture,Tables,"Hon Computer Table, with Bottom Storage",2076.606,6,9,2,2011
525,2011-02-09,Office Supplies,Binders,GBC DocuBind TL300 Electric Binding System,1793.98,2,9,2,2011
526,2011-02-09,Furniture,Chairs,"Novimex Executive Leather Armchair, Black",1236.465,3,9,2,2011
527,2011-02-09,Office Supplies,Storage,"Tenex Lockers, Single Width",561.495,5,9,2,2011
528,2011-02-09,Furniture,Chairs,"SAFCO Steel Folding Chair, Black",249.84,4,9,2,2011
529,2011-02-09,Office Supplies,Storage,"Eldon Shelving, Wire Frame",189.96,4,9,2,2011
530,2011-02-09,Technology,Accessories,Logitech Gaming G510s - Keyboard,475.944,7,9,2,2011
531,2011-02-09,Technology,Machines,Epson TM-T88V Direct Thermal Printer - Monochrome - Desktop,559.71,3,9,2,2011
532,2011-02-09,Furniture,Bookcases,"Sauder 3-Shelf Cabinet, Mobile",541.44,8,9,2,2011
533,2011-02-09,Furniture,Chairs,"Office Star Chairmat, Adjustable",307.395,5,9,2,2011
534,2011-02-09,Furniture,Bookcases,"Dania Stackable Bookrack, Mobile",486.36,4,9,2,2011
535,2011-02-09,Furniture,Chairs,"Harbour Creations Rocking Chair, Black",578.64,4,9,2,2011
536,2011-02-09,Furniture,Chairs,"Hon Bag Chairs, Set of Two",213.3,5,9,2,2011
537,2011-02-09,Furniture,Furnishings,"Tenex Door Stop, Durable",220.968,6,9,2,2011
538,2011-02-09,Office Supplies,Supplies,"Kleencut Scissors, Easy Grip",95.64,4,9,2,2011
539,2011-02-09,Office Supplies,Art,"Binney & Smith Sketch Pad, Fluorescent",158.6,5,9,2,2011
540,2011-02-09,Technology,Accessories,"Enermax Keyboard, Erganomic",243.81,3,9,2,2011
541,2011-02-09,Technology,Phones,"Apple Headset, Cordless",405.92,8,9,2,2011
542,2011-02-09,Office Supplies,Supplies,"Elite Letter Opener, High Speed",80.1,3,9,2,2011
543,2011-02-09,Furniture,Furnishings,"Eldon Photo Frame, Black",174.33,4,9,2,2011
544,2011-02-09,Office Supplies,Art,Newell 324,57.75,5,9,2,2011
545,2011-02-09,Technology,Accessories,Logitech Wireless Performance Mouse MX for PC and Mac,239.976,3,9,2,2011
546,2011-02-09,Office Supplies,Binders,"Cardinal 3-Hole Punch, Economy",86.4,3,9,2,2011
547,2011-02-09,Furniture,Furnishings,"Deflect-O Clock, Duo Pack",352.59,7,9,2,2011
548,2011-02-09,Office Supplies,Binders,"Wilson Jones Binding Machine, Recycled",147.96,3,9,2,2011
549,2011-02-09,Furniture,Furnishings,"Tenex Carpeted, Granite-Look or Clear Contemporary Contour Shape Chair Mats",70.71,1,9,2,2011
550,2011-02-09,Technology,Phones,"Motorola Speaker Phone, Full Size",131.07,1,9,2,2011
551,2011-02-09,Office Supplies,Paper,"Xerox Cards & Envelopes, Premium",44.97,1,9,2,2011
552,2011-02-09,Office Supplies,Binders,"Acco Binder, Clear",43.83,3,9,2,2011
553,2011-02-09,Technology,Phones,"Apple Office Telephone, Full Size",79.884,3,9,2,2011
554,2011-02-09,Office Supplies,Labels,"Hon Legal Exhibit Labels, Adjustable",35.04,4,9,2,2011
555,2011-02-09,Office Supplies,Storage,"Fellowes Folders, Blue",52.8,2,9,2,2011
556,2011-02-09,Office Supplies,Storage,"Fellowes Box, Wire Frame",75.0,4,9,2,2011
557,2011-02-09,Office Supplies,Envelopes,"Ames Interoffice Envelope, Recycled",131.76,3,9,2,2011
558,2011-02-09,Office Supplies,Art,"Boston Canvas, Blue",107.28,2,9,2,2011
559,2011-02-09,Office Supplies,Art,"Stanley Canvas, Water Color",105.3,2,9,2,2011
560,2011-02-09,Office Supplies,Binders,"Avery Binder Covers, Durable",50.28,4,9,2,2011
561,2011-02-09,Office Supplies,Paper,"SanDisk Memo Slips, 8.5 x 11",105.6,5,9,2,2011
562,2011-02-09,Furniture,Furnishings,"Rubbermaid Photo Frame, Durable",97.56,2,9,2,2011
563,2011-02-09,Office Supplies,Storage,"Fellowes Folders, Industrial",80.64,3,9,2,2011
564,2011-02-09,Technology,Accessories,"SanDisk Numeric Keypad, Bluetooth",221.4,4,9,2,2011
565,2011-02-09,Technology,Accessories,"SanDisk Flash Drive, Programmable",49.248,3,9,2,2011
566,2011-02-09,Office Supplies,Storage,"Eldon Box, Single Width",34.3,5,9,2,2011
567,2011-02-09,Office Supplies,Paper,Staples,14.94,3,9,2,2011
568,2011-02-09,Office Supplies,Supplies,"Stiletto Ruler, Serrated",23.16,2,9,2,2011
569,2011-02-09,Office Supplies,Fasteners,"Advantus Push Pins, Bulk Pack",86.58,6,9,2,2011
570,2011-02-09,Office Supplies,Art,SANFORD Major Accent Highlighters,21.24,3,9,2,2011
